id,chapter,question_number,question,answer,option_A,option_B,option_C,option_D,option_E,option_F
1,Ch07,1,[Ch07] 根據上圖資訊，為何兩台路由器的OSPF無法形成鄰居關係。,D,The OSPF area is not configured properly.,The priority on R1 should be set higher.,The cost on R1 should be set higher.,The hello and dead timers are not configured properly.,A backup designated router needs to be added to the network.,The OSPF process ID numbers must match.
2,Ch07,2,[Ch07] 一位網路管理者要加入一筆OSPF的路由，輸入下列的指令，但此路由並沒有出現在其它OSPF路由器的路由表中，根據下列指令，請問是什麼問題。,C,Process id is configured improperly.,The OSPF area is configured improperly.,The network wildcard mask is configured improperly.,The network number is configured improperly.,The AS is configured improperly.,The network subnet mask is configured improperly.
3,Ch07,3,[Ch07] 下列那一個指令可以顯示OSPF收集到的Link States的資訊。,D,Show ip ospf link-state,Show ip ospf Isa gatabase,Show ip ospf neighbors,Show ip OSPF database,,
4,Ch07,4,[Ch07] 再OSPF建立鄰居的過程會經歷幾個狀態，請問下列那一個狀態的順序是正確。,B,Exstart state > loading state > exchang state > full state,Exstart state > exchange state > loading state > full state,Exstart state > full state > loading state > exchange state,Loading state > exchange state > full state >exstart state,,
5,Ch07,5,[Ch07] 下列那幾項是描述OSPF路由協定的特性。,"A,C,E",It supports VLSM.,It is used to route between autonomous systems.,It confines network instability to one area of the network.,It increases routing overhead on the network.,It allows extensive control of routing updates.,It is simpler to configure than RIP v2.
6,Ch07,6,[Ch07] 請問預設的OSPF成本一樣的路由平衡是幾條路徑。,B,2,4,16,unlimited,,
7,Ch07,7,[Ch07] 根據上圖資訊，當OSPF路由器沒有手動指定ROUTER-ID時，請問會下列哪一個會成為ROUTER-ID。,C,10.1.1.2,10.154.154.1,172.16.5.1,192.168.53,,
8,Ch07,8,[Ch07] 參考下列網路架構中，假設路由協定都是正常啟動，當封包要從10.1.0.0到10.3.2.0，下列那些路徑是正確。(choose two),"A,E","If OSPF is the routing protocol, the path will be from R1 to R3 to R4 to R5","If OSPF is the routing protocol, the path will be from R1 to R2 to R5","If OSPF is the routing protocol, the path will be from R1 to R5","If RIPv2 is the routing protocol, the path will be from R1 to R3 to R4 to R5","If RIPv2 is the routing protocol, the path will be from R1 to R5",
9,Ch07,9,[Ch07] 參考下列網路架構中，下列那些敘述是正確的有關於R1選擇路徑到10.1.3.0/24根據不同的路由協定。(choose three),"A,D,E","By default, if RIPv2 is the routing protocol, only the path R1-R4 will be installed into the routing table",The equal cost paths R1-R2-R4 and R1-R3-R4 will be installed in the routing table if RIPv2 is the routing protocol,"When EIGRP is the routing protocol, only the path R1-R4 will be installed in the routing table by default","When EIGRP is the routing protocol, the equal cost paths R1-R2-R4 and R1-R3-R4 will be installed in the routing table by default","With EIGRP and OSPF both running on the network with their default configurations, the EIGRP paths will be installed in the routing table","The OSPF paths will be installed in the routing table, if EIGRP and OSPF are both running on the network with their default configurations"
10,Ch07,10,[Ch07] OSPF是使用區域概念來運作，OSPF的區域有什麼特點。,"B,C,E",Each OSPF area requires a loopback interface to be configured,Areas may be assigned any number from 0 to 65535,Area 0 is called the backbone area,Hierarchical OSPF networks do not require multiple areas,Multiple OSPF areas must connect to area 0,Single area OSPF networks must be configured in area 1.
11,Ch07,11,[Ch07] 下列那些敘述是描述OSPF路由協定。(choose three.),"A,C,E",It supports VLSM,It is used to route between autonomous systems,It confines network instability to one area of the network,It increases routing overhead on the network,It allows extensive control of routing updates,It is simpler to configure than RIP v2
12,Ch07,12,[Ch07] 下列那三項是OSPF的特點。(choose three.),"A,C,F",It converges quickly,OSPF is a classful routing protocol,It uses cost to determine the best route,It uses the DUAL algorithm to determine the best route,OSPF routers send the complete routing table to all directly attached routers,OSPF routers discover neighbors before exchanging routing information
13,Ch07,13,[Ch07] 下列那些是link-state路由協定的特點。,"A,C,D",provides common view of entire topology,exchanges routing tables with neighbors,calculates shortest path,utilizes event-triggered updates,utilizes frequent periodic updates,
14,Ch07,14,[Ch07] 下列哪一項敘述是描述OSPF的行程編號(Process ID)。(choose two.),"A,C",It is locally significant,It is globally significant,It is needed to identify a unique instance of an OSPF database,It is an optional parameter required only if multiple OSPF processes are running on the router,All routers in the same OSPF area must have the same process ID if they are to exchange routing information,
15,Ch07,15,[Ch07] 網路管理員在路由器R1中輸入R1(config-router)#network 192.168.12.64 0.0.0.63 area 0 之後，網管人員發現不是所有R1的網路介面都有參與OSPF運作，根據下列R1輸出資訊，下列哪些網路介面有參與OSPF運作。 (choose three),"B,C,D",FastEthernet0/0,FastEthernet0/1,Serial0/0,Serial0/1.102,Serial0/1.103,Serial0/1.104
16,Ch07,16,[Ch07] 一台路由器學習到三條路由可以到達相同目的網路，第一條是由EIGRP學習到且其成本為20514560，第二條為OSPF學習到且其成本782，最後一條為RIP學到且其成本為4，請問哪一條路由會被記錄到路由表。,B,A. the OSPF route,B. the EIGRP route,C. the RIPv2 route,D. all three routes,E. the OSPF and RIPv2 routes,
17,Ch07,17,[Ch07] 參考下列網路架構及部分設定輸出，假設所有路由器的網路介面及設定都是正常運作，R1的設定如下，R2會受R1的設定下列哪一種影響?,A,Router R2 will not form a neighbor relationship with R1,"Router R2 will obtain a full routing table, including a default route, from R1","R2 will obtain OSPF updates from R1, but will not obtain a default route from R1","R2 will not have a route for the directly connected serial network, but all other directly connected networks will be present, as well as the two Ethernet networks connected to R1",,
18,Ch07,18,[Ch07] 參考下列網路架構，R1無法與R3建立OSPF鄰居關係，會是什麼問題。(choose two.),"D,F",A. All of the routers need to be configured for backbone Area 1,"B. R1 and R2 are the DR and BDR, so OSPF will not establish neighbor adjacency with R3",C. A static route has been configured from R1 to R3 and prevents the neighbor adjacency from being established,D. The hello and dead interval timers are not set to the same values on R1 and R3,E. EIGRP is also configured on these routers with a lower administrative distance,F. R1 and R3 are configured in different areas
19,Ch07,19,[Ch07] 根據下圖架構，所有路由器都啟動OSPF，所有路由器的OSPF的Priority都是預設值，ROUTER ID如下表示，請問那幾台路由器會是OSPF DR。(Choose two),"D,F",A. R1,B. R2,C. R3,D. R4,E. B1,F. B2
20,Ch07,20,[Ch07] 參考下列網路架構中，有關於虛擬介面(loopback)設定在R2，下列敘述何者正確。(choose two),"B,C",It ensures that data will be forwarded by R2,It provides stability for the OSPF process on R2,It specifies that the router ID for R2 should be 10.0.0.1,It decreases the metric for routes that are advertised from R2,It indicates that R2 should be elected the DR for the LAN,
21,Ch07,21,[Ch07] 下列為R1的show ip int brief的輸出，如果R1的ROUTER ID沒有手動指定，下列哪一個會是R1中OSPF的ROUTER ID。,B,10.1.1.2,10.154.154.1,172.16.5.1,192.168.5.3,,
22,Ch07,22,[Ch07] Link-state的路由協定是使用什麼資訊來建立網路拓墣資料庫(topological database)。(Choose two),"A,C",A. hello packets,B. SAP messages sent by other routers,C. LSAs from other routers,D. beacons received on point-to-point links,E. routing tables received from other link-state routers,F. TTL packets from designated routers
23,Ch07,23,[Ch07] 在點對點的網路(point to point)環境下，OSPF hello封包的更新IP位址為何?,E,127.0.0.1,172.16.0.1,192.168.0.5,223.0.0.1,224.0.0.5,254.255.255.255
24,Ch07,24,[Ch07] 參考下列網路架構規劃，路由器A與路由器B無法建立鄰居關係，請問是什麼原因。,B,The loopback addresses are on different subnets,The values of the dead timers on the routers are different,Route summarization is enabled on both routers,The process identifier on router A is different than the process identifier on router B,,
25,Ch08,1,[Ch08] 下列哪三個是IPv6的特性。,"B,C,E",Optional IPsec,Autoconfiguration,No broadcasts,Complicated header,Plug-and-play,checksums
26,Ch08,2,[Ch08] 下列哪三個是描述IPv6 anycast特性。,"B,E,F",one-to-many communication model,one-to-nearest communication model,any-to-many communication model.,A unique IPv6 address for each device in the group,The same address for multiple devices in the group,Delivery of packets to the group interface that is closest to the sending device.
27,Ch08,3,[Ch08] 下列哪兩項是OSPFv3 與OSPFv2不一樣的地方。,"B,D",It requires the use of ARP,It can support multiple IPv6 subnets on a single link.,It supports up 2 instances of OSPFv3 over a common link.,It routes over links rather than over networks.,,
28,Ch08,4,[Ch08] 一個IPv6中，一組有幾個位元。,D,24,4,8,16,,
29,Ch08,5,[Ch08] 下列指令可以手動設定IPv6位址到路由器的網路介面中。,B,Ipv6 autoconfig 2001:db8:2222:7272::72/64,Ipv6 address 2001:db8:2222:7272::72/64,Ipv6 address PREFIX_1 ::1/64,Ipv6 autoconfig,,
30,Ch08,6,[Ch08] 請問下列那一個簡化後的IPv6代表B514:82C3:0000:0000:0029:EC7A:0000:EC72,D,B514:82C3:0029:EC7A:EC72,B514:82C3:0029:EC7A:EC72,B514:82C3:0029::EC7A:0000:EC72,B514:82C3::0029:EC7A:0:EC72,,
31,Ch08,7,[Ch08] 下列哪一個是正確的IPv6位址。,D,2001:0db8:0000:130F:0000:0000:08GC:140B,2001:0db8:0:130H::87C:140B,2031::130F::9C0:876A:130B,2031:0:130F::9C0:876A:130B,,
32,Ch08,8,[Ch08] EUI-64方式如何將48-bit MAC位址產生IPv6 位址?,D,by appending 0xFF to the MAC address,by prefixing the MAC address with 0xFFEE,by prefixing the MAC address with 0xFF and appending 0xFF to it,by inserting 0xFFFE between the upper three bytes and the lower three bytes of the MAC address,by prefixing the MAC address with 0xF and inserting 0xF after each of its first three bytes,
33,Ch08,9,[Ch08] 路由器同時執行IPv4 與IPv6兩種網路時，需要設定什麼功能?,D,4to6 routing,6to4 routing,Binary routing,Dual-stack routing,NextGen routing,
34,Ch08,10,[Ch08] 那一種IPv6的位址被稱為“ one-to-nearest”?,B,global unicast,anycast,multicast,unspecified address,,
35,Ch08,11,[Ch08] 下列那一個是正確的IPv6位址?,D,2001:0000:130F::099a::12a,2002:7654:A1AD:61:81AF:CCC1,FEC0:ABCD:WXYZ:0067::2A4,2004:1:25A4:886F::1,,
36,Ch08,12,[Ch08] 針對RIPng路遊協定，下列那些敘述是正確?,B,RIPng allows for routes with up to 30 hops,RIPng is enabled on each interface separately,RIPng uses broadcasts to exchange routes,There can be only one RIPng process per router,,
37,Ch09,1,[Ch09] 下列那一項技術是將IPv6封裝為IPv4封包?,A,tunneling,hashing,routing,NAT,,
38,Ch09,2,[Ch09] 下列哪一個IPv6位址為所有路由器的群播。,B,FF02::1,FF02::2,FF02::3,FF02::4,,
39,Ch09,3,[Ch09] 下列哪三種機制可以將IPv4轉換成為IPv6網路。,"A,C,D",Enable dual-stack routing,Config IPv6 directly,Config IPv4 tunnels between IPv6 islands,Use proxying and translation to translate IPv6 packets into IPv4 packets,Statically map IPc4 addresses to IPv6 addresses,Use DHCPv6 to map Ipv4 addresses to addresses
40,Ch09,4,[Ch09] 下列哪一個指令是啟動IPv6的路由功能。,C,Ipv6 local,Ipv6 host,Ipv6 unicat-routing,Ipv6 neighbor,,
41,Ch09,5,[Ch09] 下列哪些是IPv6過渡的機制?(choose three.),"A,D,F",6to4 tunneling,VPN tunneling,GRE tunneling,ISATAP tunneling,PPP tunneling,Teredo tunneling
42,Ch09,6,[Ch09] 下列哪兩個陳述是有關於單播IPv6位址的特性。,"A,D",Global addresses start with 2000::/3,Link-local addresses start with FE00:/12,Link-local addresses start with FF00::/10,There is only one loopback address and it is ::1,"If a global address is assigned to an interface, then that is the only allowable address for the interface.",
43,Ch10,1,[Ch10] 當一台交換器已經設定新的Trunk連線，那些Vlan的資料可以經過新的Trunk?,A,"By default, all defined VLANs are allowed on the trunk","Each single VLAN, or VLAN range, must be specified with the switchport mode command","Each single VLAN, or VLAN range, must be specified with the vtp domain command","Each single VLAN, or VLAN range, must be specified with the vlan database command",,
44,Ch10,2,[Ch10] 有兩台交換器S1與S2使用fa0/13對接，並設定為Trunk連線，在S1設定Native Vlan為Vlan10，而S2使用預設的Native Vlan，針對這樣的Native Vlan的設定，會有什麼問題產生。,C,802.1Q giants frames could saturate the link,VLAN 10 on CAT1 and VLAN 1 on CAT2 will send untagged frames,A native VLAN mismatch error message will appear,VLAN 10 on CAT1 and VLAN 1 on CAT2 will send tagged frames,,
45,Ch10,3,[Ch10] 假設目前交換器是預設組態，請問下列哪一個範圍可以增加、修改及刪除Vlan ID。,B,1 through 1001,2 through 1001,1 through 1002,2 through 1005,,
46,Ch10,4,[Ch10] 請問下列指令執行結果代表什麼意義。,B,It creates a VLAN 999 interface.,It designates VLAN 999 for untagged traffic.,It blocks VLAN 999 traffic from passing on the trunk.,It designates VLAN 999 as the default for all unkown tagged traffic.,,
47,Ch10,5,[Ch10] 目前一台路由器有兩個乙太網路介面，需要連接四個Vlan，要如何用最好的路由器的網路介面來完成這項工作。,D,Use a hub to connect the four VLANS with a Fast Ethemet interface on the router.,Add a second router to handle the VLAN traffic.,Add two more Fast Ethermet interfaces.,Implement a router-on-a-stick configuration.,,
48,Ch10,6,[Ch10] 根據上圖架構及資訊，當S1中的Vlan1送出去的資料，在S2卻是Vlan2收到，這是什麼原因造成。,C,Trunk mode mismatches,Allowing only VLAN 2 on the destination,Native VLAN mismatches,VLANs that do not correspond to a unique IP subnet,,
49,Ch10,7,[Ch10] 當交換器還未建立Vlan3時，卻執行下列指令，請問會發生什麼事情。,C,The command is rejected,The port turns amber.,The command is accepted and the respective VLAN is added to vlan dat.,The command is accepted and you must configure the VLAN manually.,,
50,Ch10,8,[Ch10] 網路管理員想從外面的網路透過Telnet連線到交換器，請問必須設定下列那些選項。(Choose two.),"A,C","The switch must be configured with an IP address, subnet mask, and default gateway",The switch must be connected to a router over a VLAN trunk,The switch must be reachable through a port connected to its management VLAN,The switch console port must be connected to the Ethernet LAN,The switch management VLAN must be created and have a membership of at least one switch port,The switch must be fully configured as an SNMP agent
51,Ch10,9,[Ch10] 當有一台Catalyst 2950 交換器要被重新設定，需要下列那些步驟才能將這台交換器的舊組態全部清除。(Choose three.),"B,C,E",A. Erase flash,B. Restart the switch,C. Delete the VLAN database,D. Erase the running configuration,E. Erase the startup configuration,F. Modify the configuration register
52,Ch10,10,[Ch10] 下列那些是VLANs的優點?(Choose three.),"A,E,F",VLANs establish broadcast domains in switched networks,VLANs utilize packet filtering to enhance network security,VLANs provide a method of conserving IP addresses in large networks,VLANs provide a low-latency internetworking alternative to routed networks,"VLANs allow access to network services based on department, not physical location","VLANs can greatly simplify adding, moving, or changing hosts on the network"
53,Ch10,11,[Ch10] 參考下圖接線架構中，在交換機的兩個連接埠沒有變成橘燈或綠燈，下列那些是有效的步驟來檢查實體層問題。(Choose three.),"B,D,F",Ensure that the Ethernet encapsulations match on the interconnected router and switch ports,Ensure that cables A and B are straight-through cables,Ensure cable A is plugged into a trunk port,Ensure the switch has power,Reboot all of the devices,Reseat all cables
54,Ch10,12,[Ch10] 參考下列網路架構中，關於路由器與交換器的連接埠，下列哪些敘述是正確。(Choose three.),"B,D,E",The Router1 WAN port is configured as a trunking port,The Router 1 port connected to Switch1 is configured using subinterfaces,The Router 1 port connected to Switch1 is configured as 10 Mbps,The Switch1 port connected to Router1 is configured as a trunking port,The Switch1 port connected to Host B is configured as an access port,The Switch1 port connected to Hub1 is configured as full duplex
55,Ch10,13,[Ch10] 參考下列網路架構中，只有電腦A、D、G可以存取server的資料，其它電腦不行，請問可以使用什麼技術來達成。(Choose two.),"A,D",access lists,encrypted router passwords,STP,VLANs,VTP,Wireless LANs
56,Ch10,14,[Ch10] 關於802.1Q trunking，下列哪些敘述是正確 (Choose three.),"A,C,E",802.1Q native VLAN frames are untagged by default,802.1Q trunking ports can also be secure ports,802.1Q trunks can use 10 Mb/s Ethernet interfaces,"802.1Q trunks require full-duplex, point-to-point connectivity",802.1Q trunks should have native VLANs that are the same at both ends,
57,Ch10,15,[Ch10] 參考下列網路架構中，網管人員在交換器與路由器設定，要將VLAN3與VLAN4中的電腦能夠存取Server，下列那些乙太網路的區段必須設定為Trunk。(Choose two.),"C,F",A,B,C,D,E,F
58,Ch10,16,[Ch10] 參考下列網路架構中，網路管理員知道Vlan4中Server必須提供給所有其它Vlan中的電腦存取，網路管理員必須設定那接連接埠為access模式?(Choose three.),"A,C,D",A. S1 – Fa0/2,B. S1 – Fa0/9,C. S2 – Fa0/3,D. S2 – Fa0/4,E. S2 – Fa0/8,F. R1– Fa1/0
59,Ch10,17,"[Ch10] 參考下列網路架構中，網管人員觀察到一個問題的現象如下，
All of the user hosts can access the Internet
None of the user hosts can access the server located in VLAN9
All of the hosts can ping each other
請問造成什麼問題?",E,S2 is turned off,Interface S0/0 on R1 is down,Interface Fa1/0 on R1 is down,Interface Fa0/5 on S3 is down,Interface Fa0/4 on S3 is down,Trunking is not enabled on the link between S1 and S3
60,Ch10,18,[Ch10] 那兩種連線的協定是用來攜帶多個Vlan的資料。,"B,D",VTP,802.1q,IGP,ISL,802.3u,
61,Ch10,19,[Ch10] 公司內有一台交換器的所有的連接埠都設定為full duplex並指定到Vlan2，如果將交換器建立新的Vlan並將連接埠指定到新的Vlan，下列那一個敘述為正確。,D,A. More collision domains will be created,B. IP address utilization will be more efficient,C. More bandwidth will be required than was needed previously,D. An additional broadcast domain will be created,,
62,Ch10,20,[Ch10] 針對Vlan來規劃網路，下列哪些敘述是正確。,"B,D",VLANs increase the size of collision domain,VLANs allow logical grouping of users by function,VLANs simplify switch administration,VLANs enhance network security,,
63,Ch10,21,[Ch10] 在一家公司的網路中，主機在相同Vlan可以互相傳送資料，但是主機在不同Vlan中卻無法傳送資料，需要什麼設定才能解決此問題。,A,a router with subinterfaces configured on the physical interface that is connected to the switch,a router with an IP address on the physical interface connected to the switch,a switch with an access link that is configured between the switches,a switch with a trunk link that is configured between the switches,,
64,Ch10,22,[Ch10] 下列為交換器S1的show int fa0/24 switchport的輸出訊息，在S1的fa0/24要設定為IEEE 802.1Q-compliant trunk與其它交換器做連線，但是Trunk連線一直無法成功，網路線確認是正常，根據下列輸出訊息，請問是那部份設定錯誤。,C,VLANs have not been created yet,An IP address must be configured for the port,The port is currently configured for access mode,The correct encapsulation type has not been configured,The no shutdown command has not been entered for the port,
65,Ch10,23,[Ch10] 參考下列網路架構中，兩台交換器中的Vlan10之間無法互通，另外Vlan15之間也無法互通，只有Admin Vlan之間可以互相傳送資料，兩台交換器的連接埠的Vlan分配都是一樣，根據下列show vlan brief的輸出訊息中，請問有什麼問題嗎。,B,The fa0/1 port is not operational on one of the switches,The link connecting the switches has not been configured as a trunk,At least one port needs to be configured in VLAN 1 for VLANs 10 and 15 to be able to communicate,Port FastEthernet 0/1 needs to be configured as an access link on both switches,A router is required for hosts on SW11 in VLANs 10 and 15 to communicate with hosts in the same VLAN on Sw12,
66,Ch10,24,[Ch10] 參考下列網路架構中，網路管理員需要增加一個新Vlan3，但是在路由器上已經沒有多餘的網路介面可以給Vlan3使用，請問使用哪種技術可以解決此問題。,D,Purchase a new FastEthernet module and install it on R1,ReplaceR1 with a new router that has at least three FastEthernet interface,Configure a second switch to support VLAN3 with a VALN trunk between SW1 and the new switch,Configure a single VLAN trunk between R1 and configure a subinterface on the R1 interface for each VLAN,Connect another router to a serial interface of R1. Use a FastEthernet interface on the new router for VLAN3,
67,Ch10,25,[Ch10] 參考下列網路架構中，有關於Vlan之間的繞送，下列哪些敘述是正確?(choose two.),"D,F",Host E and host F use the same IP gateway address,Router1 and Switch2 should be connected via a crossover cable,Router1 will not play a role in communications between host A and host D,The FastEthernt 0/0 interface on Router1 must be configured with subinterfaces,Router1 needs more LAN interfaces to accommodate the VLANs that are shown in the exhibit,The FastEthernet 0/0 interface on Router1 and Switch2 trunk ports must be configured using the same encapsulation type
68,Ch10,26,[Ch10] 參考下圖網路架構中，網路管理員要在交換器S1上增加主機A與B，針對這兩台的相關IP位址設定，下列何者正確?(Choose three),"A,C,F",host A ip address: 192.168.1.79,host A IP address: 192.168.1.64,host A default gateway: 192.168.1.78,host B IP address: 192.168.1.128,host B default gateway: 192.168.1.129,host B IP address: 192.168.1.190
69,Ch10,27,[Ch10] 根據下圖網路架構與部分訊息，目前該網路有不通的情況，請問是下列哪些問題?(Choose two.),"B,D",Configure the gateway on Host A as 10.1.1.1,Configure the gateway on Host B as 10.1.2.254,Configure the IP address of Host A as 10.1.2.2,Configure the IP address of Host B as 10.1.2.2,Configure the masks on both hosts to be 255.255.255.224,Configure the masks on both hosts to be 255.255.255.240
70,Ch10,28,[Ch10] 參考下列網路架構，路由器R1已經設定提供Vlan之間的路由功能，針對交換器的fa0/1連線到路由器，必須使用下列那些IOS指令來設定IEEE標準的協定?(Choose three.),"A,C,F",Switch(config)#interface fastethernet 0/1,Switch(config-if)#switchport mode access,Switch(config-if)#switchport mode trunk,Switch(config-if)#switchport access vlan 1,Switch(config-if)#switchport trunk encapsulation isl,Switch(config-if)#switchport trunk encapsulation dot1q
71,Ch10,29,[Ch10] 根據下圖網路架構與主機數目需求，所有主機都必須互相聯通，關於IP位址下列那些是正確?(choose three.),"B,C,F",The subnet mask in Vlan 1 is 255.255.255.192,The subnet mask in Vlan2 is 255.255.255.128,The IP address 172.16.1.25 can be assigned to hosts in VLAN1,The IP address 172.16.1.205 can be assigned to hosts in VLAN1,The LAN interface of the router is configured with one IP address,The LAN interface of the router is configured with multiple IP addresses
72,Ch10,30,[Ch10] 根據下列網路架構與部分訊息，如果要讓所有電腦裝置都能互通，在交換器的fa0/1需要什麼設定?,B,The ports only need to be connected by a crossover cable,"SwitchX(config)#interface fastethernet0/1
SwitchX(config-if)#switchport mode trunk","SwitchX(config)#interface fastethernet 0/1
SwitchX(config-if)#switchport mode access
SwitchX(config-if)#switchport access vlan 1","SwitchX(config)#interface fastethernet 0/1
SwitchX(config-if)#switchport mode trunk
SwitchX(config-if)#switchport trunk vlan 1
SwitchX(config-if)#switchport trunk vlan 10
SwitchX(config-if)#switchport trunk vlan 20",,
73,Ch11,1,[Ch11] 在什麼樣的交換器的網路環境之下，電腦會收到多個相同的單播封包。,D,During high traffic periods,After broken links are re-established,When upper-layer protocols require high reliability,In an improperly implemented redundant topology,When a dual ring topology is in use,
